{
  "schema": 1,
  "id": "mockingbird.forward_crew.cabins",
  "hull": "mockingbird",
  "slot": "forward_crew",
  "name": "Forward crew cabins",
  "mass": 6.0,
  "provides": { "berths": 4 },
  "requires": { "power": 1 },
  "patches": [
    {
      "deck": 0, "x": 6, "y": 5,
      "grid": [
        "###",
        "#d#",
        "# #",
        "# #",
        "we=",
        "###",
        "###",
        "#d#",
        "# #",
        "# #",
        "we=",
        "###"
      ]
    }
  ]
}
