{
  "schema": 1,
  "id": "rijay.hold.breakbulk_8x11",
  "hull": "mockingbird",
  "slot": "hold",
  "name": "Break-bulk hold",
  "mass": 4.0,
  "provides": {},
  "requires": { "power": 1 },
  "patches": [
    {
      "deck": 2, "x": 3, "y": 10,
      "grid": [
        "   ###                  ",
        " . c               .  . ",
        "   #                    ",
        "   #                #   ",
        " . #p     p  p  p  p# . ",
        "   #                #   ",
        "###                  ###",
        "#p  p     p  p  p  p  p#",
        "#                      #",
        "#                      #",
        "#p  p     p  p  p  p  p#",
        "#                      #",
        "#                      #",
        "#p  p     p  p  p  p  p#",
        "#                      #",
        "#                      #",
        "#p  p     p  p  p  p  p#",
        "#                      #",
        "#                      #",
        "#p  p     p  p  p  p  p#",
        "#                      #",
        "#                      #",
        "#p  p     p  p  p  p  p#",
        "###                  ###",
        "   #                #   ",
        " . #p     p  p  p  p# . ",
        "   #                #   ",
        "   #                #   ",
        " . #p     p  p  p  p# . ",
        "   ###            ###   ",
        "                 #      ",
        " .  .  .  p  p  p# .  . ",
        "         #########      "
      ]
    }
  ]
}
