{
  "schema": 1,
  "id": "refit_testbed.bay.empty",
  "hull": "refit_testbed",
  "slot": "bay",
  "name": "Empty bay",
  "mass": 1.0,
  "patches": [
    {
      "deck": 0,
      "x": 1,
      "y": 1,
      "grid": [
        "   ###      ",
        " . # # .  . ",
        "    ##      "
      ]
    }
  ]
}
