{
  "schema": 1,
  "id": "mockingbird.hold.tank",
  "hull": "mockingbird",
  "slot": "hold",
  "name": "Bunkerage hold",
  "mass": 9.0,
  "provides": { "fuel": 20 },
  "requires": { "power": 1 },
  "patches": [
    {
      "deck": 2, "x": 3, "y": 10,
      "grid": [
        "   ###                  ",
        " . c               .  . ",
        "   #                    ",
        "   #                #   ",
        " . #                # . ",
        "   #                #   ",
        "###                  ###",
        "#                      #",
        "#                      #",
        "#                      #",
        "#                      #",
        "#                      #",
        "#                      #",
        "#                      #",
        "#                      #",
        "#                      #",
        "#                      #",
        "#                      #",
        "#                      #",
        "#p  p     p  p  p  p  p#",
        "#                      #",
        "#                      #",
        "#p  p     p  p  p  p  p#",
        "###                  ###",
        "   #                #   ",
        " . #p     p  p  p  p# . ",
        "   #                #   ",
        "   #                #   ",
        " . #p     p  p  p  p# . ",
        "   ###            ###   ",
        "                 #      ",
        " .  .  .  p  p  p# .  . ",
        "         #########      "
      ]
    }
  ]
}
